{
  "output_language": "ja",
  "output_dir": "specs",
  "primary_reader": "maintenance_developer",
  "reader_action": "code_change",
  "granularity": "high_level_overview",
  "perspectives": ["functional_correctness"],
  "existing_docs": "none",
  "free_text_notes": "",
  "user_custom_deliverables": [],
  "depth_mode": "comprehensive"
}
